{
  "$schema": "./home.schema.json",
  "hero": {
    "headline": "Every pixel, on purpose.",
    "headlineTag": "h1",
    "headlineRole": "display-lg"
  },
  "bio": {
    "headline": "The short version.",
    "headlineTag": "h2",
    "headlineRole": "display-md",
    "body": "Associate Design Director at Razorfish with 13+ years in UI, UX, motion, and design systems. I've shipped work for Samsung, Frontier, and CVS. Mostly I obsess over the details most people scroll right past.",
    "bodyTag": "p",
    "bodyRole": "title-lg"
  },
  "work": {
    "headline": "Selected Work",
    "headingTag": "h2",
    "headingRole": "headline-lg",
    "cardTitleTag": "p",
    "cardTitleRole": "headline-sm"
  },
  "experience": {
    "headline": "Experience",
    "headingTag": "h2",
    "headingRole": "headline-lg",
    "jobTitleTag": "p",
    "jobTitleRole": "body-lg",
    "companyTag": "p",
    "companyRole": "body-lg",
    "highlightTag": "p",
    "highlightRole": "body-lg",
    "jobs": [
      {
        "title": "Associate Design Director",
        "company": "Razorfish",
        "location": "Remote",
        "startDate": "2021-10",
        "endDate": null,
        "highlights": [
          "Leads UX and design systems for Samsung, Frontier, and CVS product redesigns."
        ]
      },
      {
        "title": "Senior Designer",
        "company": "Razorfish",
        "location": "New York, NY",
        "startDate": "2018-06",
        "endDate": "2021-10",
        "highlights": [
          "Designed flows, prototypes, and motion systems for Samsung and Barclays. Built the interaction patterns, delivered the specs."
        ]
      },
      {
        "title": "Product Designer",
        "company": "Independent",
        "location": "New York, NY",
        "startDate": "2016-08",
        "endDate": "2018-06",
        "highlights": [
          "Built interactive prototypes and motion systems for early-stage products and client pitches. The kind of work that turns a deck into something you can actually click through."]
      },
      {
        "title": "Art Director",
        "company": "Mashable",
        "location": "New York, NY",
        "startDate": "2014-03",
        "endDate": "2016-08",
        "highlights": [
          "Led design and motion direction for Mashable's Snapchat Discover launch and ran daily creative production."
        ]
      },
      {
        "title": "Motion Designer",
        "company": "NowThis News",
        "location": "New York, NY",
        "startDate": "2012-08",
        "endDate": "2014-03",
        "highlights": [
          "Built the motion templates behind NowThis's daily social videos and redesigned the brand identity at an early stage."
        ]
      }
    ]
  },
  "interests": {
    "textRole": "display-lg",
    "items": [
      "Apple fanboy",
      "Pixel peeper",
      "Curious",
      "Dubstep head",
      "Historian",
      "Gear nerd",
            "Homelabber",
      "Analytical",
      "Vinylhead",
      "Fussy",
      "Restorer",
      "Cinephile",
      "Mac power user",
      "Methodical",
      "Spec goblin",
      "Designer",
      "Overthinker",
      "Precise",
      "Horror fiend",
      "Typophile",
      "Collector",
      "Interface nerd",
      "HiFi nerd",
      "Pragmatic",
      "Manga reader",
      "Tinkerer",
      "Discerning",
      "Sci fi nerd",
      "Archivist",
      "Button masher",
      "Refined",
      "Maker",
      "Reader",
      "Audiophile",
      "History buff",
      "Finicky",
      "Philosopher",
      "Comic nerd",
      "Picky",
      "Persnickety",
      "Gamer",
      "Obsessive",
      "Nerd",
      "Geek",
      "Enthusiast",
      "Movie snob",
      "Music snob",
      "Audio snob",
      "File hoarder",
      "Tab collector",
      "Rabbit holer",
      "Catastrophizer",
      "Perfectionist",
      "Control freak",
      "Night owl",
      "Internet person",
      "Techie",
      "Gadget guy",
      "Denim nerd",
      "Boot nerd",
      "Leather nerd",
      "Watch nerd",
      "Motion nerd",
      "Design nerd",
      "Retrohead",
      "Minimalist",
      "Maximalist",
      "Experimental",
      "Imaginative",
      "Opinionated",
      "Particular",
      "Finisher",
      "Fixer",
      "Problem solver",
      "Researcher",
      "Systems thinker",
      "Detail freak",
      "Noise chaser",
      "Format snob",
      "Codec nerd",
      "Playlist curator",
      "Record flipper",
      "Game collector",
      "History nerd",
      "Screen junkie",
      "Comic hoarder",
      "Manga hoarder",
      "Sci fi obsessive",
      "Horror obsessive",
      "Basshead",
      "Wire wrangler",
      "Router whisperer",
      "Server gremlin",
      "Cable manager",
      "Backup evangelist",
      "Firmware updater",
      "Button clicker",
      "UI nitpicker",
      "UX critic"
    ]
  }
}
